{
  "$schema": "http://json-schema.org/draft-07/schema#",
  "$id": "https://raw.githubusercontent.com/bludit/plugins/main/rules/plugin.schema.json",
  "title": "Bludit plugin submission",
  "description": "One file per plugin inside plugins/. The filename must be <id>.json. Every field that also exists inside the zip is compared against it by the workflow. Fields derived by CI (sha256, size) must not be present.",
  "type": "object",
  "additionalProperties": false,
  "required": ["id", "name", "description", "author", "website", "license", "compatible", "version", "releaseDate", "download"],
  "properties": {
    "id": {
      "type": "string",
      "pattern": "^[a-z0-9][a-z0-9-]{1,48}$",
      "description": "Directory name created inside bl-plugins. Must match the filename of the submission."
    },
    "name": {
      "type": "string",
      "minLength": 2,
      "maxLength": 60
    },
    "description": {
      "type": "string",
      "minLength": 10,
      "maxLength": 300,
      "pattern": "^[^\\n\\r]+$",
      "description": "One line, no line breaks. Must be identical to plugin-data.description in languages/en.json."
    },
    "author": {
      "type": "string",
      "minLength": 1,
      "maxLength": 60
    },
    "website": {
      "type": "string",
      "format": "uri",
      "pattern": "^https://",
      "maxLength": 300
    },
    "license": {
      "type": "string",
      "minLength": 2,
      "maxLength": 40,
      "description": "SPDX identifier, for example MIT or GPL-3.0-or-later. Use PROPRIETARY for a closed licence. Must be identical to the license in the metadata.json of the plugin."
    },
    "compatible": {
      "type": "string",
      "pattern": "^[0-9]+\\.[0-9]+(,[0-9]+\\.[0-9]+)*$",
      "description": "Comma separated list of major.minor Bludit versions, for example 4.0 or 4.0,4.1"
    },
    "version": {
      "type": "string",
      "minLength": 1,
      "maxLength": 20,
      "description": "Must be identical to the version inside the metadata.json of the plugin."
    },
    "releaseDate": {
      "type": "string",
      "pattern": "^[0-9]{4}-[0-9]{2}-[0-9]{2}$"
    },
    "download": {
      "type": "string",
      "format": "uri",
      "pattern": "^https://github\\.com/[^/]+/[^/]+/releases/download/[^/]+/[^/]+\\.zip$",
      "description": "GitHub release asset. Archives generated by GitHub (/archive/*.zip) are not accepted, their bytes are not stable and the checksum would not hold."
    },
    "type": {
      "type": "string",
      "enum": ["", "editor", "theme"],
      "description": "Leave empty for a regular plugin. Must be identical to the type in the metadata.json of the plugin, which may omit it."
    },
    "tags": {
      "type": "array",
      "maxItems": 8,
      "items": {
        "type": "string",
        "pattern": "^[a-z0-9][a-z0-9-]{1,24}$"
      }
    }
  }
}
